[
  {
    "id": "relic:blessed-pollen",
    "name": "Blessed Pollen",
    "requiredSlotLevel": 10,
    "statModifiers": {
      "ed": 2,
      "hp": 1,
      "pd": 2
    },
    "specialEffectsText": [],
    "costs": [
      {
        "amount": 12,
        "currency": "platinum"
      },
      {
        "amount": 6,
        "currency": "gems"
      }
    ],
    "image": "assets/relics/blessed_pollen.png",
    "sourceImageUrl": "https://cdn.worldofmiscrits.com/relics/blessed_pollen.png",
    "provenance": {
      "sourceId": "companion-relics",
      "retrievedOn": "2026-09-15",
      "method": "rendered-dom",
      "gameVerified": false
    }
  },
  {
    "id": "relic:brash-s-kiss",
    "name": "Brash's Kiss",
    "requiredSlotLevel": 10,
    "statModifiers": {
      "ea": 2,
      "hp": 1,
      "pa": 2
    },
    "specialEffectsText": [],
    "costs": [
      {
        "amount": 12,
        "currency": "platinum"
      },
      {
        "amount": 6,
        "currency": "gems"
      }
    ],
    "image": "assets/relics/brashs_kiss.png",
    "sourceImageUrl": "https://cdn.worldofmiscrits.com/relics/brashs_kiss.png",
    "provenance": {
      "sourceId": "companion-relics",
      "retrievedOn": "2026-09-15",
      "method": "rendered-dom",
      "gameVerified": false
    }
  },
  {
    "id": "relic:cloud-cake",
    "name": "Cloud Cake",
    "requiredSlotLevel": 10,
    "statModifiers": {
      "ea": 3,
      "spd": 1
    },
    "specialEffectsText": [],
    "costs": [
      {
        "amount": 12,
        "currency": "platinum"
      },
      {
        "amount": 6,
        "currency": "gems"
      }
    ],
    "image": "assets/relics/cloud_cake.png",
    "sourceImageUrl": "https://cdn.worldofmiscrits.com/relics/cloud_cake.png",
    "provenance": {
      "sourceId": "companion-relics",
      "retrievedOn": "2026-09-15",
      "method": "rendered-dom",
      "gameVerified": false
    }
  },
  {
    "id": "relic:dark-owlie-feather",
    "name": "Dark Owlie Feather",
    "requiredSlotLevel": 10,
    "statModifiers": {
      "pa": 1,
      "spd": 3
    },
    "specialEffectsText": [],
    "costs": [
      {
        "amount": 12,
        "currency": "platinum"
      },
      {
        "amount": 6,
        "currency": "gems"
      }
    ],
    "image": "assets/relics/dark_owlie_feather.png",
    "sourceImageUrl": "https://cdn.worldofmiscrits.com/relics/dark_owlie_feather.png",
    "provenance": {
      "sourceId": "companion-relics",
      "retrievedOn": "2026-09-15",
      "method": "rendered-dom",
      "gameVerified": false
    }
  },
  {
    "id": "relic:elefauna-flower",
    "name": "Elefauna Flower",
    "requiredSlotLevel": 10,
    "statModifiers": {
      "ea": 3,
      "hp": 1
    },
    "specialEffectsText": [],
    "costs": [
      {
        "amount": 12,
        "currency": "platinum"
      },
      {
        "amount": 6,
        "currency": "gems"
      }
    ],
    "image": "assets/relics/elefauna_flower.png",
    "sourceImageUrl": "https://cdn.worldofmiscrits.com/relics/elefauna_flower.png",
    "provenance": {
      "sourceId": "companion-relics",
      "retrievedOn": "2026-09-15",
      "method": "rendered-dom",
      "gameVerified": false
    }
  },
  {
    "id": "relic:eternal-falls-mushroom",
    "name": "Eternal Falls Mushroom",
    "requiredSlotLevel": 10,
    "statModifiers": {
      "ed": 1,
      "hp": 3
    },
    "specialEffectsText": [],
    "costs": [
      {
        "amount": 12,
        "currency": "platinum"
      },
      {
        "amount": 6,
        "currency": "gems"
      }
    ],
    "image": "assets/relics/eternal_falls_mushroom.png",
    "sourceImageUrl": "https://cdn.worldofmiscrits.com/relics/eternal_falls_mushroom.png",
    "provenance": {
      "sourceId": "companion-relics",
      "retrievedOn": "2026-09-15",
      "method": "rendered-dom",
      "gameVerified": false
    }
  },
  {
    "id": "relic:frost-root",
    "name": "Frost Root",
    "requiredSlotLevel": 10,
    "statModifiers": {
      "ea": -1,
      "ed": -1,
      "pa": -1,
      "pd": -1
    },
    "specialEffectsText": [
      "Sleep Immunity"
    ],
    "costs": [
      {
        "amount": 24,
        "currency": "platinum"
      },
      {
        "amount": 12,
        "currency": "gems"
      }
    ],
    "image": "assets/relics/frost_root.png",
    "sourceImageUrl": "https://cdn.worldofmiscrits.com/relics/frost_root.png",
    "provenance": {
      "sourceId": "companion-relics",
      "retrievedOn": "2026-09-15",
      "method": "rendered-dom",
      "gameVerified": false
    }
  },
  {
    "id": "relic:gk-s-slippers",
    "name": "GK's Slippers",
    "requiredSlotLevel": 10,
    "statModifiers": {
      "spd": 4
    },
    "specialEffectsText": [],
    "costs": [
      {
        "amount": 12,
        "currency": "platinum"
      },
      {
        "amount": 6,
        "currency": "gems"
      }
    ],
    "image": "assets/relics/gks_slippers.png",
    "sourceImageUrl": "https://cdn.worldofmiscrits.com/relics/gks_slippers.png",
    "provenance": {
      "sourceId": "companion-relics",
      "retrievedOn": "2026-09-15",
      "method": "rendered-dom",
      "gameVerified": false
    }
  },
  {
    "id": "relic:lake-azore-pearl",
    "name": "Lake Azore Pearl",
    "requiredSlotLevel": 10,
    "statModifiers": {
      "ed": 1,
      "hp": 3,
      "pd": 1
    },
    "specialEffectsText": [],
    "costs": [
      {
        "amount": 12,
        "currency": "platinum"
      },
      {
        "amount": 6,
        "currency": "gems"
      }
    ],
    "image": "assets/relics/lake_azore_pearl.png",
    "sourceImageUrl": "https://cdn.worldofmiscrits.com/relics/lake_azore_pearl.png",
    "provenance": {
      "sourceId": "companion-relics",
      "retrievedOn": "2026-09-15",
      "method": "rendered-dom",
      "gameVerified": false
    }
  },
  {
    "id": "relic:pamboo-cane",
    "name": "Pamboo Cane",
    "requiredSlotLevel": 10,
    "statModifiers": {
      "hp": 5
    },
    "specialEffectsText": [],
    "costs": [
      {
        "amount": 12,
        "currency": "platinum"
      },
      {
        "amount": 6,
        "currency": "gems"
      }
    ],
    "image": "assets/relics/pamboo_cane.png",
    "sourceImageUrl": "https://cdn.worldofmiscrits.com/relics/pamboo_cane.png",
    "provenance": {
      "sourceId": "companion-relics",
      "retrievedOn": "2026-09-15",
      "method": "rendered-dom",
      "gameVerified": false
    }
  },
  {
    "id": "relic:quartex-crystal",
    "name": "Quartex Crystal",
    "requiredSlotLevel": 10,
    "statModifiers": {
      "ea": -1,
      "ed": -1,
      "pa": -1,
      "pd": -1
    },
    "specialEffectsText": [
      "Confuse Immunity"
    ],
    "costs": [
      {
        "amount": 24,
        "currency": "platinum"
      },
      {
        "amount": 12,
        "currency": "gems"
      }
    ],
    "image": "assets/relics/quartex_crystal.png",
    "sourceImageUrl": "https://cdn.worldofmiscrits.com/relics/quartex_crystal.png",
    "provenance": {
      "sourceId": "companion-relics",
      "retrievedOn": "2026-09-15",
      "method": "rendered-dom",
      "gameVerified": false
    }
  },
  {
    "id": "relic:skelepup-s-spark",
    "name": "Skelepup's Spark",
    "requiredSlotLevel": 10,
    "statModifiers": {
      "ea": 1,
      "spd": 3
    },
    "specialEffectsText": [],
    "costs": [
      {
        "amount": 12,
        "currency": "platinum"
      },
      {
        "amount": 6,
        "currency": "gems"
      }
    ],
    "image": "assets/relics/skelepups_spark.png",
    "sourceImageUrl": "https://cdn.worldofmiscrits.com/relics/skelepups_spark.png",
    "provenance": {
      "sourceId": "companion-relics",
      "retrievedOn": "2026-09-15",
      "method": "rendered-dom",
      "gameVerified": false
    }
  },
  {
    "id": "relic:woodsman-s-axe-head",
    "name": "Woodsman's Axe Head",
    "requiredSlotLevel": 10,
    "statModifiers": {
      "hp": 1,
      "pa": 3
    },
    "specialEffectsText": [],
    "costs": [
      {
        "amount": 12,
        "currency": "platinum"
      },
      {
        "amount": 6,
        "currency": "gems"
      }
    ],
    "image": "assets/relics/woodsmans_axe_head.png",
    "sourceImageUrl": "https://cdn.worldofmiscrits.com/relics/woodsmans_axe_head.png",
    "provenance": {
      "sourceId": "companion-relics",
      "retrievedOn": "2026-09-15",
      "method": "rendered-dom",
      "gameVerified": false
    }
  },
  {
    "id": "relic:bean-stalk",
    "name": "Bean Stalk",
    "requiredSlotLevel": 20,
    "statModifiers": {
      "ed": 11,
      "hp": 2
    },
    "specialEffectsText": [],
    "costs": [
      {
        "amount": 36,
        "currency": "platinum"
      },
      {
        "amount": 16,
        "currency": "gems"
      }
    ],
    "image": "assets/relics/bean_stalk.png",
    "sourceImageUrl": "https://cdn.worldofmiscrits.com/relics/bean_stalk.png",
    "provenance": {
      "sourceId": "companion-relics",
      "retrievedOn": "2026-09-15",
      "method": "rendered-dom",
      "gameVerified": false
    }
  },
  {
    "id": "relic:elemental-explosion",
    "name": "Elemental Explosion",
    "requiredSlotLevel": 20,
    "statModifiers": {
      "ea": 6,
      "hp": 6
    },
    "specialEffectsText": [],
    "costs": [
      {
        "amount": 36,
        "currency": "platinum"
      },
      {
        "amount": 16,
        "currency": "gems"
      }
    ],
    "image": "assets/relics/elemental_explosion.png",
    "sourceImageUrl": "https://cdn.worldofmiscrits.com/relics/elemental_explosion.png",
    "provenance": {
      "sourceId": "companion-relics",
      "retrievedOn": "2026-09-15",
      "method": "rendered-dom",
      "gameVerified": false
    }
  },
  {
    "id": "relic:emerald-scales",
    "name": "Emerald Scales",
    "requiredSlotLevel": 20,
    "statModifiers": {
      "pa": 9,
      "pd": 3
    },
    "specialEffectsText": [],
    "costs": [
      {
        "amount": 36,